{
  "$schema": "http://json-schema.org/draft-07/schema#",
  "title": "Import/Export election file",
  "description": "File used to import/export all election data",
  "type": "object",
  "additionalProperties": false,
  "required": [
    "date",
    "type",
    "configuration",
    "districts"
  ],
  "properties": {
    "date": {
      "type": "string",
      "format": "date"
    },
    "type": {
      "type": "string",
      "enum": [
        "regional",
        "congress",
        "local"
      ]
    },
    "configuration": {
      "type": "object",
      "additionalProperties": false,
      "required": [
        "threshold"
      ],
      "properties": {
        "threshold": {
          "type": "number",
          "minimum": 0,
          "maximum": 100
        }
      }
    },
    "districts": {
      "type": "array",
      "items": {
        "type": "object",
        "additionalProperties": false,
        "required": [
          "name",
          "voters",
          "representatives",
          "blank",
          "null",
          "candidatures"
        ],
        "properties": {
          "name": {
            "type": "string",
            "pattern": "^([a-zA-ZÀ-ÿ\u00f1\u00d1 ]){1,120}$"
          },
          "voters": {
            "type": "number",
            "exclusiveMinimum": 0,
            "multipleOf": 1.0
          },
          "representatives": {
            "type": "number",
            "exclusiveMinimum": 0,
            "multipleOf": 1.0
          },
          "blank": {
            "type": "number",
            "minimum": 0,
            "multipleOf": 1.0
          },
          "null": {
            "type": "number",
            "minimum": 0,
            "multipleOf": 1.0
          },
          "candidatures": {
            "type": "array",
            "items": {
              "type": "object",
              "additionalProperties": false,
              "required": [
                "name",
                "abbrv",
                "votes"
              ],
              "properties": {
                "name": {
                  "type": "string",
                  "pattern": "^([a-zA-ZÀ-ÿ\u00f1\u00d1]){1}([ a-zA-Z0-9À-ÿ\u00f1\u00d1-]|_){0,99}$",
                  "maxLength": 70
                },
                "abbrv": {
                  "type": "string",
                  "pattern": "^([a-zA-ZÀ-ÿ\u00f1\u00d1]){1}([a-zA-Z0-9À-ÿ\u00f1\u00d1-]|_){0,19}$"
                },
                "votes": {
                  "type": "number",
                  "minimum": 0,
                  "multipleOf": 1.0
                }
              }
            }
          }
        }
      }
    }
  }
}
